{
  "schema_version": "1.0.0",
  "id": "PRC-RES-CLAIM",
  "version": "0.1.0",
  "title": {
    "ja": "科学的主張・根拠対応表の構成と評価の実施手順（試案）"
  },
  "lifecycle": "draft",
  "responsible_role": "調査担当者",
  "authority": {
    "origin": "independent_proposal",
    "normative_class": "operational_proposal",
    "institutional_approval": "none",
    "applicability_note": "特定組織の内部規程や承認済み手順を示さない。適用法令、現場の権限・規程、情報の公開条件を確認した上で個別案件へ適用する。"
  },
  "access": {
    "classification": "public",
    "may_share_with_external_ai": true
  },
  "sources": [],
  "links": [],
  "required_roles": [
    "調査担当者"
  ],
  "inputs": [
    "出典台帳、方法要約票、数字確認記録、対立資料"
  ],
  "outputs": [
    "主張・根拠対応表、留保した主張と修正案"
  ],
  "steps": [
    {
      "id": "PRC-RES-CLAIM-S1",
      "instruction": "伝えたい主要な内容を独立した検証可能な主張単位に分ける。",
      "expected_output": "主張・根拠対応表、留保した主張と修正案",
      "evidence_needed": false
    },
    {
      "id": "PRC-RES-CLAIM-S2",
      "instruction": "主張に観測、推定、解釈、仮説、予測、目標の区分を付す。",
      "expected_output": "主張・根拠対応表、留保した主張と修正案",
      "evidence_needed": true
    },
    {
      "id": "PRC-RES-CLAIM-S3",
      "instruction": "出典識別子と該当ページ・図表・データを結びつける。",
      "expected_output": "主張・根拠対応表、留保した主張と修正案",
      "evidence_needed": true
    },
    {
      "id": "PRC-RES-CLAIM-S4",
      "instruction": "出典が当該主張を支持、限定、反証、又は未検証のどれに相当するか評価する。",
      "expected_output": "主張・根拠対応表、留保した主張と修正案",
      "evidence_needed": true
    },
    {
      "id": "PRC-RES-CLAIM-S5",
      "instruction": "研究対象や方法から許される文言の範囲を明記し、誇張を避ける表現を提案する。",
      "expected_output": "主張・根拠対応表、留保した主張と修正案",
      "evidence_needed": true
    },
    {
      "id": "PRC-RES-CLAIM-S6",
      "instruction": "AI支援による候補と人間が原資料を照合した記録を区別する。",
      "expected_output": "主張・根拠対応表、留保した主張と修正案",
      "evidence_needed": true
    },
    {
      "id": "PRC-RES-CLAIM-S7",
      "instruction": "未解決の主張を先送りする際は公開予定の表現と取材質問の見直し条件を示す。",
      "expected_output": "主張・根拠対応表、留保した主張と修正案",
      "evidence_needed": true
    }
  ],
  "exception_handling": [
    "原資料に到達できないとき、資料の真正性が確認できないとき、又は版の不一致が見つかったときは、関連項目を未確認として保留し照会先を特定する。",
    "権利又は秘密保持上の問題がある資料は外部共有・公開・外部AIへの入力を止め、担当者が許可条件を確認する。",
    "新たな反証、研究内容の訂正、追加データが明らかになった際は、元の判断を上書きせず再調査の記録を追記する。"
  ]
}
